{
  "schemaVersion": "pipesim-well-result/1",
  "model_kind": "basic_gas",
  "runTask": "combined",
  "resultContract": "VALID_FULL",
  "units": {
    "flow": {
      "displayUnit": "mmscf/d",
      "semantics": "standard_gas_volume_rate"
    },
    "pressure": {
      "displayUnit": null,
      "semantics": "unspecified"
    },
    "depth": {
      "displayUnit": null,
      "semantics": "unspecified"
    },
    "temperature": {
      "displayUnit": null,
      "semantics": "unspecified"
    }
  },
  "ipr": [
    {
      "flow": 10.107890445262832,
      "pressure": 41.16646888383564
    },
    {
      "flow": 0.10107890445262832,
      "pressure": 3998.3244712445376
    },
    {
      "flow": 8.651427251904805,
      "pressure": 1845.9107073729356
    },
    {
      "flow": 8.661495952667359,
      "pressure": 1839.7913755588506
    },
    {
      "flow": 8.65723959623475,
      "pressure": 1842.3811572311545
    },
    {
      "flow": 4.376253078178715,
      "pressure": 3403.938563072297
    },
    {
      "flow": 2.238665991315672,
      "pressure": 3798.2133792894174
    },
    {
      "flow": 9.384693198965097,
      "pressure": 1314.6784179386132
    },
    {
      "flow": 1.16987244788415,
      "pressure": 3926.8574945419
    },
    {
      "flow": 6.51384016504176,
      "pressure": 2803.9866649820824
    },
    {
      "flow": 9.746291822113964,
      "pressure": 934.6988276912438
    },
    {
      "flow": 9.927091133688398,
      "pressure": 663.1863765921238
    },
    {
      "flow": 3.307459534747194,
      "pressure": 3623.7321233276066
    },
    {
      "flow": 0.6354756761683893,
      "pressure": 3971.557057517409
    },
    {
      "flow": 7.582633708473281,
      "pressure": 2391.5599179309006
    },
    {
      "flow": 10.017490789475616,
      "pressure": 470.4122187795992
    },
    {
      "flow": 5.445046621610237,
      "pressure": 3134.223373248833
    },
    {
      "flow": 1.7042692195999112,
      "pressure": 3868.550086540956
    },
    {
      "flow": 10.062690617369226,
      "pressure": 334.1017032138519
    },
    {
      "flow": 2.773062763031433,
      "pressure": 3716.5369726765475
    },
    {
      "flow": 0.3682772903105089,
      "pressure": 3987.737035458456
    },
    {
      "flow": 3.8418563064629545,
      "pressure": 3519.672440300819
    },
    {
      "flow": 0.9026740620262697,
      "pressure": 3951.0668589506668
    },
    {
      "flow": 8.117030480189042,
      "pressure": 2141.0215183594
    },
    {
      "flow": 9.023094575816227,
      "pressure": 1601.7313335974256
    },
    {
      "flow": 10.085290531316026,
      "pressure": 238.10181446076112
    },
    {
      "flow": 4.910649849894476,
      "pressure": 3275.8113897318067
    },
    {
      "flow": 1.4370708337420304,
      "pressure": 3899.276877377227
    },
    {
      "flow": 7.04823693675752,
      "pressure": 2610.1403587148993
    },
    {
      "flow": 5.979443393325998,
      "pressure": 2977.660135199082
    }
  ],
  "vlp": [
    {
      "flow": 0.03596322573849776,
      "pressure": 2487.4640717247885
    },
    {
      "flow": 8.651427251904805,
      "pressure": 1845.9107073729356
    },
    {
      "flow": 14.970424570120446,
      "pressure": 2279.091415206806
    },
    {
      "flow": 21.190425984768233,
      "pressure": 2973.058997637125
    },
    {
      "flow": 25.094537850772795,
      "pressure": 3474.385865746785
    },
    {
      "flow": 29.44201300586278,
      "pressure": 3985.558098774036
    },
    {
      "flow": 3.48214883620502,
      "pressure": 1817.8622519956784
    },
    {
      "flow": 1.4144374699251065,
      "pressure": 2006.928608825124
    },
    {
      "flow": 17.458425135979564,
      "pressure": 2531.527950644989
    },
    {
      "flow": 32.050498098916776,
      "pressure": 4305.615188200027
    },
    {
      "flow": 11.17902617919106,
      "pressure": 1981.349709822847
    },
    {
      "flow": 0.5873529234131413,
      "pressure": 2208.532744174231
    },
    {
      "flow": 5.5498602024849335,
      "pressure": 1801.1912203790644
    },
    {
      "flow": 26.833527912808787,
      "pressure": 3678.253639103833
    },
    {
      "flow": 0.2565191048083552,
      "pressure": 2358.8591588668833
    },
    {
      "flow": 22.752070731170058,
      "pressure": 3170.821816305144
    },
    {
      "flow": 18.951225475495033,
      "pressure": 2698.4567665866225
    },
    {
      "flow": 12.695585535562813,
      "pressure": 2088.558293717493
    },
    {
      "flow": 33.61558915474916,
      "pressure": 4498.522655201638
    },
    {
      "flow": 2.241522016437072,
      "pressure": 1897.7679232475184
    },
    {
      "flow": 6.790487022252881,
      "pressure": 1826.2407931521284
    },
    {
      "flow": 0.9181867420179274,
      "pressure": 2111.5124789891224
    },
    {
      "flow": 15.965624796464093,
      "pressure": 2375.6215130864034
    },
    {
      "flow": 27.876921950030386,
      "pressure": 3801.379192350277
    },
    {
      "flow": 9.662466822819306,
      "pressure": 1892.4966225037556
    },
    {
      "flow": 30.48540704308438,
      "pressure": 4113.129254791302
    },
    {
      "flow": 23.689057579011155,
      "pressure": 3291.785091041672
    },
    {
      "flow": 19.846905679204312,
      "pressure": 2806.0694624345338
    },
    {
      "flow": 0.12418557736644072,
      "pressure": 2303.951055154261
    },
    {
      "flow": 35.963225738497755,
      "pressure": 4797.989365493445
    }
  ],
  "profile": [
    {
      "depth": 160.0,
      "pressure": 1100.164027049467,
      "temperature": 146.519674549995
    },
    {
      "depth": 1160.0,
      "pressure": 1161.6759843201705,
      "temperature": 154.0798990921768
    },
    {
      "depth": 2160.0,
      "pressure": 1232.8747961337572,
      "temperature": 161.33289225196086
    },
    {
      "depth": 3160.0,
      "pressure": 1320.2230939808335,
      "temperature": 168.81862505978734
    },
    {
      "depth": 4000.0,
      "pressure": 1408.5372022568386,
      "temperature": 175.80740017769006
    },
    {
      "depth": 4625.0,
      "pressure": 1540.1096958311475,
      "temperature": 184.61109351653795
    },
    {
      "depth": 5250.0,
      "pressure": 1667.0370386931484,
      "temperature": 192.49818729499168
    },
    {
      "depth": 5875.0,
      "pressure": 1790.4089612990915,
      "temperature": 199.7880709151383
    },
    {
      "depth": 6500.0,
      "pressure": 1911.0228823109514,
      "temperature": 206.13400606620564
    },
    {
      "depth": 7125.000000000001,
      "pressure": 2029.4304278928512,
      "temperature": 212.0814727755759
    },
    {
      "depth": 7750.000000000001,
      "pressure": 2146.0504058243414,
      "temperature": 217.17492424872432
    },
    {
      "depth": 8375.0,
      "pressure": 2261.473938615675,
      "temperature": 221.8256513375735
    },
    {
      "depth": 8375.0,
      "pressure": 2261.210818211273,
      "temperature": 221.8190630782924
    },
    {
      "depth": 9000.0,
      "pressure": 4000.0,
      "temperature": 249.99999999998226
    },
    {
      "depth": 9000.0,
      "pressure": 2330.477896793876,
      "temperature": 225.30886403621707
    },
    {
      "depth": 9000.0,
      "pressure": 2330.477896793876,
      "temperature": 225.30886403621707
    }
  ]
}
