{
  "schemaVersion": "pipesim-well-result/1",
  "model_kind": "black_oil_liquid",
  "runTask": "combined",
  "resultContract": "VALID_FULL",
  "units": {
    "flow": {
      "displayUnit": null,
      "semantics": "unspecified"
    },
    "pressure": {
      "displayUnit": null,
      "semantics": "unspecified"
    },
    "depth": {
      "displayUnit": null,
      "semantics": "unspecified"
    },
    "temperature": {
      "displayUnit": null,
      "semantics": "unspecified"
    }
  },
  "ipr": [
    {
      "flow": 347.0576274866894,
      "pressure": 30.09060059963531
    },
    {
      "flow": 3.4705762748668936,
      "pressure": 2980.3069965094614
    },
    {
      "flow": 175.26410188077813,
      "pressure": 1997.468594839963
    },
    {
      "flow": 89.3673390778225,
      "pressure": 2504.0574710742862
    },
    {
      "flow": 261.16086468373373,
      "pressure": 1340.6400311584014
    },
    {
      "flow": 46.418957676344704,
      "pressure": 2739.608230190838
    },
    {
      "flow": 304.10924608521157,
      "pressure": 882.8545231676217
    },
    {
      "flow": 325.5834367859504,
      "pressure": 567.9765491461108
    },
    {
      "flow": 24.9447669756058,
      "pressure": 2859.277726447743
    },
    {
      "flow": 132.31572047930032,
      "pressure": 2263.604246422544
    },
    {
      "flow": 218.21248328225593,
      "pressure": 1696.2133837926535
    },
    {
      "flow": 336.3205321363199,
      "pressure": 356.3745132207846
    },
    {
      "flow": 67.8931483770836,
      "pressure": 2621.225249012669
    },
    {
      "flow": 14.207671625236346,
      "pressure": 2919.6177177233603
    },
    {
      "flow": 110.84152977856141,
      "pressure": 2386.8156365648692
    },
    {
      "flow": 341.68907981150466,
      "pressure": 219.3619898561592
    },
    {
      "flow": 282.63505538447265,
      "pressure": 1130.1440091881027
    },
    {
      "flow": 153.78991118003924,
      "pressure": 2134.1718357144196
    },
    {
      "flow": 35.68186232597525,
      "pressure": 2799.2776371686527
    },
    {
      "flow": 239.68667398299485,
      "pressure": 1527.082881451283
    },
    {
      "flow": 196.73829258151702,
      "pressure": 1852.1113555661832
    },
    {
      "flow": 314.846341435581,
      "pressure": 737.3968231592157
    },
    {
      "flow": 57.15605302671415,
      "pressure": 2680.2604195303043
    },
    {
      "flow": 78.63024372745305,
      "pressure": 2562.493811668869
    },
    {
      "flow": 344.37335364909706,
      "pressure": 135.07042621838264
    },
    {
      "flow": 8.839123950051619,
      "pressure": 2949.9181073007394
    },
    {
      "flow": 330.95198446113517,
      "pressure": 469.45546727549754
    },
    {
      "flow": 100.10443442819196,
      "pressure": 2445.907564829706
    },
    {
      "flow": 293.3721507348421,
      "pressure": 1012.3236676173767
    },
    {
      "flow": 19.576219300421073,
      "pressure": 2889.404653931763
    }
  ],
  "vlp": [
    {
      "flow": 639.5697776028882,
      "pressure": 2758.302491893592
    },
    {
      "flow": 0.639569777602888,
      "pressure": 3774.220251884067
    },
    {
      "flow": 109.55927768634893,
      "pressure": 3332.5277605246188
    },
    {
      "flow": 308.4440875367041,
      "pressure": 3042.9981444874707
    },
    {
      "flow": 440.8943635631777,
      "pressure": 2910.8618945829944
    },
    {
      "flow": 189.113201626491,
      "pressure": 3195.693704684889
    },
    {
      "flow": 520.364529179062,
      "pressure": 2843.4990441574896
    },
    {
      "flow": 44.20745294110131,
      "pressure": 3514.3421860839153
    },
    {
      "flow": 361.4241979472935,
      "pressure": 2986.422359197973
    },
    {
      "flow": 236.84555599057626,
      "pressure": 3129.3837795383597
    },
    {
      "flow": 568.0466285485925,
      "pressure": 2807.4405563986
    },
    {
      "flow": 141.38084726240575,
      "pressure": 3270.527033622566
    },
    {
      "flow": 70.34818283920036,
      "pressure": 3422.361041048386
    },
    {
      "flow": 18.066723043002256,
      "pressure": 3653.6729302508875
    },
    {
      "flow": 393.2122641936472,
      "pressure": 2954.8341316102747
    },
    {
      "flow": 265.4849686090274,
      "pressure": 3093.8517123331417
    },
    {
      "flow": 472.68242980953136,
      "pressure": 2882.55115343314
    },
    {
      "flow": 596.6558881703107,
      "pressure": 2787.0017722131356
    },
    {
      "flow": 160.47378900803986,
      "pressure": 3238.767940231794
    },
    {
      "flow": 86.0326207780598,
      "pressure": 3383.9520914238938
    },
    {
      "flow": 208.20614337212513,
      "pressure": 3167.8836039804874
    },
    {
      "flow": 329.6361317009399,
      "pressure": 3019.737592700294
    },
    {
      "flow": 28.523015002241873,
      "pressure": 3591.96943552895
    },
    {
      "flow": 7.610431083762635,
      "pressure": 3724.190755581654
    },
    {
      "flow": 412.2851039414594,
      "pressure": 2936.388212592736
    },
    {
      "flow": 282.66861618009807,
      "pressure": 3072.767716151826
    },
    {
      "flow": 491.7552695573436,
      "pressure": 2866.6008908715253
    },
    {
      "flow": 539.4373689268741,
      "pressure": 2828.771424280114
    },
    {
      "flow": 54.66374490034092,
      "pressure": 3472.763927698184
    },
    {
      "flow": 122.28790551677163,
      "pressure": 3305.3285000278584
    }
  ],
  "profile": [
    {
      "depth": 0.0,
      "pressure": 299.9520296530212,
      "temperature": 67.03671874323595
    },
    {
      "depth": 1000.0,
      "pressure": 529.8099592992168,
      "temperature": 88.77696172979518
    },
    {
      "depth": 1700.0000000000002,
      "pressure": 716.9047967254854,
      "temperature": 103.49332307625559
    },
    {
      "depth": 2599.3614533681102,
      "pressure": 978.6155421038748,
      "temperature": 123.62655811602372
    },
    {
      "depth": 2700.0,
      "pressure": 1008.4707569187107,
      "temperature": 125.88132146957685
    },
    {
      "depth": 3599.36145336811,
      "pressure": 1276.110199867058,
      "temperature": 146.04149694790237
    },
    {
      "depth": 3699.999999999999,
      "pressure": 1306.2068969760785,
      "temperature": 148.29271373087954
    },
    {
      "depth": 4599.280575539569,
      "pressure": 1576.6417444228587,
      "temperature": 168.39650840865397
    },
    {
      "depth": 4700.0,
      "pressure": 1607.089379722465,
      "temperature": 170.6400883525514
    },
    {
      "depth": 5599.36145336811,
      "pressure": 1880.0846736673004,
      "temperature": 190.60195071761734
    },
    {
      "depth": 5700.0,
      "pressure": 1910.7359953138655,
      "temperature": 192.81849003021478
    },
    {
      "depth": 6599.36145336811,
      "pressure": 2185.242217722415,
      "temperature": 212.38280120217917
    },
    {
      "depth": 6700.0,
      "pressure": 2216.0071479832654,
      "temperature": 214.5256992293065
    },
    {
      "depth": 6999.820143884889,
      "pressure": 2307.694438648908,
      "temperature": 218.9053006435696
    },
    {
      "depth": 6999.820143884889,
      "pressure": 2307.694438648908,
      "temperature": 220.83288345457777
    },
    {
      "depth": 6999.820143884889,
      "pressure": 2307.694438648908,
      "temperature": 220.83288345457777
    },
    {
      "depth": 6999.999999999999,
      "pressure": 2307.76109308399,
      "temperature": 218.9090242711112
    },
    {
      "depth": 7700.0,
      "pressure": 2566.79262428384,
      "temperature": 230.8694815922363
    },
    {
      "depth": 7700.449680726679,
      "pressure": 2566.9587206156925,
      "temperature": 230.8757453119298
    },
    {
      "depth": 7700.449680726679,
      "pressure": 2566.9587206156925,
      "temperature": 230.8757453119298
    },
    {
      "depth": 8599.81113409479,
      "pressure": 2897.1553954645856,
      "temperature": 253.9061411031596
    },
    {
      "depth": 8700.0,
      "pressure": 2933.7296623876077,
      "temperature": 257.05475011028886
    },
    {
      "depth": 9000.0,
      "pressure": 5000.0,
      "temperature": 249.99999999998226
    },
    {
      "depth": 9000.0,
      "pressure": 3042.907284480558,
      "temperature": 268.1816006627623
    },
    {
      "depth": 9000.0,
      "pressure": 3042.907284480558,
      "temperature": 268.1816006627623
    }
  ]
}
